{
  "specVersion": "dao-the-game.networks.v1",
  "phase": "production",
  "registration": {
    "chainKey": "base",
    "chainId": 8453,
    "chainName": "Base",
    "nativeSymbol": "ETH",
    "erc8004RegistryAddress": "0x8004A169FB4a3325136EB29fA0ceB6D2e539a432"
  },
  "payments": {
    "chainKey": "base",
    "chainId": 8453,
    "chainName": "Base",
    "nativeSymbol": "ETH",
    "asset": "USDC",
    "protocol": "x402"
  },
  "notes": [
    "Use Base mainnet for both ERC-8004 registration and worker payment setup.",
    "DAO the Game caps paid worker license pricing at 1 USDC per request attempt."
  ]
}
